{
  "schema": "uavr.feed.adsb/1",
  "source_id": "anws-adsb",
  "sent_at": "2026-10-02T08:00:05Z",
  "states": [
    {
      "icao24": "8991a2",
      "callsign": "EVA0012",
      "t": "2026-10-02T08:00:04Z",
      "lat": 25.0712,
      "lon": 121.2611,
      "alt_baro_m": 450,
      "ground_speed_mps": 80,
      "track_deg": 233,
      "on_ground": false
    }
  ]
}